{"actor": "agent-1", "approval_chain_summary": {"authority": "tenant-A/write-grant", "proposer": "agent-1", "validator_id": "constitutional-council", "validator_role": "validator"}, "argument_hash": "0000000000000000000000000000000000000000000000000000000000000000", "audit_event_hash": "audit_hash", "authority": "tenant-A/write-grant", "constraints": {}, "decision": "allow", "declared_goal": "", "execution_boundary": "local-sandbox", "expires_at": "", "matched_rules": [], "policy_bundle_id": "policy-bundle", "policy_hash": "policy-hash", "policy_version": "v1", "previous_audit_hash": "prev_audit_hash", "proposed_action": "runtime.file.write", "receipt_hash": "42b18d9ce2041f6fab04484c7e442278864ceb1576a909ee7f8f9231fa8815c9", "receipt_id": "ev_abc", "request_id": "req-123", "signature": "0a848b06944b02146b03a1c97ffb9cf0e5ef92c5e6a3a996712228224b0ded55974636d56bf31360fd9a2fadcdabd77c5a2ec8129d6fbfae609db4f02900700d", "signature_algorithm": "ed25519", "signing_key_id": "fixture-key-1", "subject": "", "tenant_id": "tenant-A", "timestamp": "2026-01-01T00:00:00+00:00", "transformations": [], "validator_id": "constitutional-council", "validator_role": "validator"}
