{"actor": "agent-1", "approval_chain_summary": {"authority": "tenant-A/write-grant", "proposer": "agent-1", "validator_id": "constitutional-council", "validator_role": "validator"}, "argument_hash": "219047a66622d406ff0271e408d59d2f9f971de94d93a9fcf059793aad08b5fe", "audit_event_hash": "audit_hash", "authority": "tenant-A/write-grant", "constraints": {}, "decision": "allow", "declared_goal": "", "execution_boundary": "local-sandbox", "expires_at": "", "matched_rules": [], "policy_bundle_id": "policy-bundle", "policy_hash": "policy-hash", "policy_version": "v1", "previous_audit_hash": "prev_audit_hash", "proposed_action": "runtime.file.write", "receipt_hash": "892346986dcf1ebd4bd717492020cbf54bdd508165b1d6173ab8c4aa5f61a0d4", "receipt_id": "ev_abc", "request_id": "req-123", "signature": "f0f4288dd9aa59f47bc7b0e8cd1f595c5f1f977bc921127bb255313984683a36c6c7c6c7f5296f6732752b535fb8c3cbf4ef5ef629e4f14140e9e03972c3740f", "signature_algorithm": "ed25519", "signing_key_id": "fixture-key-evil", "subject": "", "tenant_id": "tenant-A", "timestamp": "2026-01-01T00:00:00+00:00", "transformations": [], "validator_id": "constitutional-council", "validator_role": "validator"}
