{"actor": "agent-1", "approval_chain_summary": {"authority": "tenant-A/write-grant", "proposer": "agent-1", "validator_id": "constitutional-council", "validator_role": "validator"}, "argument_hash": "219047a66622d406ff0271e408d59d2f9f971de94d93a9fcf059793aad08b5fe", "audit_event_hash": "audit_hash", "authority": "tenant-A/write-grant", "constraints": {}, "decision": "allow", "declared_goal": "", "execution_boundary": "local-sandbox", "expires_at": "2025-06-01T00:00:00+00:00", "matched_rules": [], "policy_bundle_id": "policy-bundle", "policy_hash": "policy-hash", "policy_version": "v1", "previous_audit_hash": "prev_audit_hash", "proposed_action": "runtime.file.write", "receipt_hash": "76f3ac20c7ef3a5c369dee1131e2455b1a19265a354b35335d0d8139377efb07", "receipt_id": "ev_abc", "request_id": "req-123", "signature": "a25e466736561ff7bb68a26fcfa85542a74de197fc30f8bd1f94b6dfc4d1dd89089dd0c1c4d06d8207c48fd83a36d8a0c6f77ecb1d0b9941c31fb85c98c9ad03", "signature_algorithm": "ed25519", "signing_key_id": "fixture-key-1", "subject": "", "tenant_id": "tenant-A", "timestamp": "2026-01-01T00:00:00+00:00", "transformations": [], "validator_id": "constitutional-council", "validator_role": "validator"}
