{"actor": "compliance-officer", "approval_chain_summary": {"authority": "tenant-A/write-grant", "proposer": "compliance-officer", "validator_id": "constitutional-council", "validator_role": "validator"}, "argument_hash": "b81819a1936ad035f097473bcb31d78f89ed74b38ff8a5afbdc82117bf830753", "audit_event_hash": "baf9e6e9f84389cf711e461bb29de94bf29d3ffc3037d2aa0c62c584ad379d4f", "authority": "tenant-A/write-grant", "constraints": {}, "decision": "allow", "declared_goal": "write compliance report", "execution_boundary": "local-sandbox", "expires_at": "", "matched_rules": [], "policy_bundle_id": "compliance-ruleset/v1", "policy_hash": "ruleset/compliance-ruleset/v1/be02ba386af91111ba8e2f4a3a74eb60f67761c17dabdf62de3935b1c5b6bfe7", "policy_version": "ruleset/compliance-ruleset/v1/be02ba386af91111ba8e2f4a3a74eb60f67761c17dabdf62de3935b1c5b6bfe7", "previous_audit_hash": "0000000000000000000000000000000000000000000000000000000000000000", "proposed_action": "runtime.file.write", "receipt_hash": "b834e4650be90f3cd4e7051492b1d2e3e7a990807531bc68e9eb7af2a56e43b1", "receipt_id": "ev_dd403a0da23143e6", "request_id": "req-allow", "signature": "ac72571c6f5ae56f362af435b8f1f3a66a96509ae07b902a0169f5df4542476eb6d15e37739297337140f1c794b905b12376520b8250cbcf96aeda06efffb200", "signature_algorithm": "ed25519", "signing_key_id": "fixture-key-1", "subject": "", "tenant_id": "tenant-A", "timestamp": "2026-07-27T10:23:02.161071+00:00", "transformations": [], "validator_id": "constitutional-council", "validator_role": "validator"}
