{"actor": "agent-1", "approval_chain_summary": {"authority": "tenant-A/write-grant", "proposer": "agent-1", "validator_id": "constitutional-council", "validator_role": "validator"}, "argument_hash": "219047a66622d406ff0271e408d59d2f9f971de94d93a9fcf059793aad08b5fe", "audit_event_hash": "audit_hash", "authority": "tenant-A/write-grant", "constraints": {}, "decision": "allow", "declared_goal": "", "execution_boundary": "local-sandbox", "expires_at": "", "matched_rules": [], "policy_bundle_id": "policy-bundle", "policy_hash": "policy-hash", "policy_version": "v1", "previous_audit_hash": "prev_audit_hash", "proposed_action": "runtime.file.write", "receipt_hash": "cf60d473a89ce1659cc50b5ac3874dd200873a26b599c6e0421f4501eaec6fb8", "receipt_id": "ev_abc", "request_id": "req-123", "signature": "31939a4abb3bfc752bdbf5985d454b2ea7add16468b671d5fdd7869c4b9e7dd7fb7ebe6736705e38117f883ffde8f2660604b130690802e3c75efb812938e704", "signature_algorithm": "ed25519", "signing_key_id": "fixture-key-1", "subject": "", "tenant_id": "tenant-A", "timestamp": "2026-01-01T00:00:00+00:00", "transformations": [], "validator_id": "constitutional-council", "validator_role": "validator"}
