{"actor": "compliance-officer", "approval_chain_summary": {"authority": "tenant-A/write-grant", "proposer": "compliance-officer", "validator_id": "constitutional-council", "validator_role": "validator"}, "argument_hash": "b81819a1936ad035f097473bcb31d78f89ed74b38ff8a5afbdc82117bf830753", "audit_event_hash": "fc957b9782b6056b9af2baaeb9054a69d80327c45cdd5efc81b5beb35e777ea5", "authority": "tenant-A/write-grant", "constraints": {}, "decision": "allow", "declared_goal": "write compliance report", "execution_boundary": "local-sandbox", "expires_at": "", "matched_rules": [], "policy_bundle_id": "compliance-ruleset/v1", "policy_hash": "ruleset/compliance-ruleset/v1/be02ba386af91111", "policy_version": "ruleset/compliance-ruleset/v1/be02ba386af91111", "previous_audit_hash": "0000000000000000000000000000000000000000000000000000000000000000", "proposed_action": "runtime.file.write", "receipt_hash": "9405c6d62d3b47a375cdf5ab1803500a55260b0379e7d49bb7720eb03a0b93d6", "receipt_id": "ev_7d241528aa27483e", "request_id": "req-allow", "signature": "c874e200c5f23665d48a62d4df6c9e12e996b51f3691ee175e33fed56173ddf19b4682edc88c72581d617a28a160f2e57cc980c28f934e3b9e11274301658b08", "signature_algorithm": "ed25519", "signing_key_id": "fixture-key-1", "subject": "", "tenant_id": "tenant-A", "timestamp": "2026-06-18T13:51:38.946454+00:00", "transformations": [], "validator_id": "constitutional-council", "validator_role": "validator"}
