{"actor": "compliance-officer", "approval_chain_summary": {"authority": "tenant-A/write-grant", "proposer": "compliance-officer", "validator_id": "constitutional-council", "validator_role": "validator"}, "argument_hash": "dbe9c046099f8329cee928296db6c1cef9771ac8db773a6c4dd206c01b90fd56", "audit_event_hash": "f3260c70dfb9402b402950db41adbe0895b36bfd085d73a2e5aba128dc6ca430", "authority": "tenant-A/write-grant", "constraints": {}, "decision": "allow", "declared_goal": "g-1", "execution_boundary": "local-sandbox", "expires_at": "", "matched_rules": [], "policy_bundle_id": "compliance-ruleset/v1", "policy_hash": "ruleset/compliance-ruleset/v1/be02ba386af91111", "policy_version": "ruleset/compliance-ruleset/v1/be02ba386af91111", "previous_audit_hash": "0000000000000000000000000000000000000000000000000000000000000000", "proposed_action": "runtime.file.write", "receipt_hash": "8f7153b5d58d00bbe077ceca455c94a1f2c3b75ced5a64eb1054c8eae62f8671", "receipt_id": "ev_91173c10c1094a6c", "request_id": "req-1", "signature": "unsigned_local", "signature_algorithm": "none", "signing_key_id": "", "subject": "", "tenant_id": "tenant-A", "timestamp": "2026-06-18T13:51:38.951933+00:00", "transformations": [], "validator_id": "constitutional-council", "validator_role": "validator"}
