{"actor": "agent-1", "approval_chain_summary": {"authority": "tenant-A/write-grant", "proposer": "agent-1", "validator_id": "constitutional-council", "validator_role": "validator"}, "argument_hash": "219047a66622d406ff0271e408d59d2f9f971de94d93a9fcf059793aad08b5fe", "audit_event_hash": "audit_hash", "authority": "tenant-A/write-grant", "constraints": {}, "decision": "transform", "declared_goal": "", "execution_boundary": "local-sandbox", "expires_at": "", "matched_rules": [], "policy_bundle_id": "policy-bundle", "policy_hash": "policy-hash", "policy_version": "v1", "previous_audit_hash": "prev_audit_hash", "proposed_action": "runtime.file.write", "receipt_hash": "542a6dc24bfa7cc803d88aac1ce1cc43f57a4cd6c02e955e9466b12e0434de93", "receipt_id": "ev_abc", "request_id": "req-123", "signature": "57fea67e92c73e2dc5599351add2175d55882d3eae7a9455d17bd88ff84d18d93cffbec8d1c6332d61e875c4e2a0ab04b900a9a798b0cf73581272428e01b106", "signature_algorithm": "ed25519", "signing_key_id": "fixture-key-1", "subject": "", "tenant_id": "tenant-A", "timestamp": "2026-01-01T00:00:00+00:00", "transformations": [{"field": "path", "value": "redacted.txt"}], "validator_id": "constitutional-council", "validator_role": "validator"}
