{"actor": "compliance-officer", "approval_chain_summary": {"authority": "tenant-A/write-grant", "proposer": "compliance-officer", "validator_id": "constitutional-council", "validator_role": "validator"}, "argument_hash": "e2668bfdb207108718d36dcb5b199fa50d747868604582390aa26db4e5633ca7", "audit_event_hash": "f60fc833e4e04366f8f1532942add50682ec7da2b597a8f7d1c51e960d2c3959", "authority": "tenant-A/write-grant", "constraints": {}, "decision": "allow", "declared_goal": "g-2", "execution_boundary": "local-sandbox", "expires_at": "", "matched_rules": [], "policy_bundle_id": "compliance-ruleset/v1", "policy_hash": "ruleset/compliance-ruleset/v1/be02ba386af91111", "policy_version": "ruleset/compliance-ruleset/v1/be02ba386af91111", "previous_audit_hash": "f3260c70dfb9402b402950db41adbe0895b36bfd085d73a2e5aba128dc6ca430", "proposed_action": "runtime.file.write", "receipt_hash": "4a70d4f4699cda614dc35787ef3bbc0b918a2d2ddaad41c66cdbae044fe3beba", "receipt_id": "ev_705da4fb57d5430d", "request_id": "req-2", "signature": "unsigned_local", "signature_algorithm": "none", "signing_key_id": "", "subject": "", "tenant_id": "tenant-A", "timestamp": "2026-06-18T13:51:38.961247+00:00", "transformations": [], "validator_id": "constitutional-council", "validator_role": "validator"}
