{"actor": "agent-1", "approval_chain_summary": {"authority": "tenant-A/write-grant", "proposer": "agent-1", "validator_id": "constitutional-council", "validator_role": "validator"}, "argument_hash": "219047a66622d406ff0271e408d59d2f9f971de94d93a9fcf059793aad08b5fe", "audit_event_hash": "audit_hash", "authority": "tenant-A/write-grant", "constraints": {}, "decision": "escalate", "declared_goal": "", "execution_boundary": "local-sandbox", "expires_at": "", "matched_rules": [], "policy_bundle_id": "policy-bundle", "policy_hash": "policy-hash", "policy_version": "v1", "previous_audit_hash": "prev_audit_hash", "proposed_action": "runtime.file.write", "receipt_hash": "fcc21b62789d6390a46e1edec7e090fb26cd057449ee580d840101303f7ace7f", "receipt_id": "ev_abc", "request_id": "req-123", "signature": "99a6f85cdeb93f68be92443eb9e080436715da9d38e534ede5d150fa419e6057f9dc983422538d9a415a3d4c8ad83b76c28dbb160229e06d36afa41c180c6d00", "signature_algorithm": "ed25519", "signing_key_id": "fixture-key-1", "subject": "", "tenant_id": "tenant-A", "timestamp": "2026-01-01T00:00:00+00:00", "transformations": [], "validator_id": "constitutional-council", "validator_role": "validator"}
